{
  "$schema": "../../schemas/lab.schema.json",
  "schema_version": "0.2.0",
  "id": "feature-flags",
  "title": "Feature-flag Playground",
  "summary": "Change application behavior through App Configuration, deliberately corrupt a flag, then repair it without redeploying.",
  "state": "implemented",
  "difficulty": "beginner",
  "time_tier": "standard",
  "domains": [
    "configuration",
    "applications",
    "troubleshooting"
  ],
  "portable_capabilities": [
    "configuration",
    "applications",
    "troubleshooting"
  ],
  "objectives": [
    "Change application behavior through App Configuration, deliberately corrupt a flag, then repair it without redeploying.",
    "Try the healthy path, reproduce a controlled failure and verify recovery.",
    "Collect sanitized evidence and remove only the selected deployment."
  ],
  "execution": {
    "azure": "functions",
    "local_minutes": 10
  },
  "implementations": {
    "azure": {
      "status": "implemented",
      "estimated_minutes": 45,
      "required_services": [
        "azure_functions",
        "app_service",
        "storage",
        "application_insights",
        "log_analytics",
        "monitor_alerts",
        "app_configuration"
      ],
      "optional_services": [],
      "requirements": {
        "managed_identity": false,
        "gpu": false,
        "resource_group_creation": false,
        "concurrent_sandboxes": 1
      },
      "resource_requirements": {
        "app_service": {
          "sku": "Y1",
          "server_farms": 1
        }
      },
      "sandbox_notes": [
        "Implemented with offline checks; no live Pluralsight deployment has been verified.",
        "Use only the assigned resource group; one project per session.",
        "Local adapters/simulations do not validate Azure permissions, timing, networking or quotas."
      ],
      "production_extensions": [
        "Use least-privilege identities, durable protected state, release controls and service-appropriate private access."
      ]
    }
  },
  "evidence": [
    "Allowlisted functional check summary",
    "Sanitized recovery observations",
    "Reviewed cleanup outcome"
  ],
  "verification_records": []
}
