{
  "$schema": "../../schemas/lab.schema.json",
  "schema_version": "0.2.0",
  "id": "container-playground",
  "title": "Container Playground",
  "summary": "Run the same small HTTP application in Python, Docker or an isolated Azure container; change versions and reproduce a startup failure.",
  "state": "implemented",
  "difficulty": "beginner",
  "time_tier": "standard",
  "domains": [
    "containers",
    "compute",
    "configuration"
  ],
  "portable_capabilities": [
    "containers",
    "compute",
    "configuration"
  ],
  "objectives": [
    "Run the same small HTTP application in Python, Docker or an isolated Azure container; change versions and reproduce a startup failure.",
    "Try the healthy path, reproduce a controlled failure and verify recovery.",
    "Collect sanitized evidence and remove only the selected deployment."
  ],
  "execution": {
    "azure": "container",
    "local_minutes": 10
  },
  "implementations": {
    "azure": {
      "status": "implemented",
      "estimated_minutes": 45,
      "required_services": [
        "container_instances"
      ],
      "optional_services": [],
      "requirements": {
        "managed_identity": false,
        "gpu": false,
        "resource_group_creation": false,
        "concurrent_sandboxes": 1
      },
      "resource_requirements": {
        "container_instances": {
          "container_groups": 1,
          "containers_per_group": 1,
          "cpu_per_container": 1,
          "memory_gb_per_container": 1
        }
      },
      "sandbox_notes": [
        "Implemented with offline checks; no live Pluralsight deployment has been verified.",
        "Use only the assigned resource group; one project per session.",
        "Local adapters/simulations do not validate Azure permissions, timing, networking or quotas."
      ],
      "production_extensions": [
        "Use least-privilege identities, durable protected state, release controls and service-appropriate private access."
      ]
    }
  },
  "evidence": [
    "Allowlisted functional check summary",
    "Sanitized recovery observations",
    "Reviewed cleanup outcome"
  ],
  "verification_records": []
}
